speaker,content
tutor,"欢迎！今天，我们将通过一个经典的谜题来探讨平均速度和速率的概念。

想象一下，一位司机以每小时30英里的速度从A市开到B市，然后以每小时60英里的速度从B市开回A市。这位司机全程的平均速度是多少，你会如何着手解决这个问题呢？"
student,嗯，不就是每小时45英里吗？我觉得就是把30和60加起来得到90，然后因为有两趟行程，所以除以二。
tutor,这是个很自然的第一反应，因为求两个数的平均值通常就是把它们相加再除以二。然而，平均速度的定义是总路程除以总时间。为了理解这一点，我们不妨假设A市和B市之间的距离是60英里——那么去程和返程分别需要多少时间呢？
student,等等，让我想想。如果是60英里……以每小时30英里的速度去需要2小时，对吗？然后以每小时60英里的速度回来只需要1小时？
tutor,"完全正确！你把单程的行驶时间算得非常准。

现在，用这些数字，整个往返行程的*总*路程是多少，以及驾驶的*总*时间是多少？得到这些数据后，要怎么计算出全程的平均速度呢？"
student,"所以总路程是120英里，因为单程是60英里，总时间是3小时。如果我用120除以3，就得到40。

等等，所以平均速度是每小时40英里，而不是45？为什么会不一样呢？"
tutor,计算得非常好，完全正确！之所以不同，是因为司机以较慢速度行驶的时间（2小时）比以较快速度行驶的时间（1小时）要长，这使得总体平均速度更接近每小时30英里。你会如何用自己的话向一个仍然认为答案应该是每小时45英里的人解释这个概念呢？
student,哦，这下完全说得通了！我想我会告诉他们，你不能只取速度的中间值，因为你用慢速行驶的时间要长得多。慢速行驶的两个小时比快速行驶的一个小时对整体平均值的拉低作用更大。我这样解释可以吗？
tutor,你解释得非常漂亮，关于时间拉低平均值的推理也完全正确！为了进一步检验这个概念，你认为如果城市间的距离是120英里而不是60英里，平均速度会改变吗？为什么会或者为什么不会呢？
student,"让我快速算一下。如果是120英里，去程需要4小时，返程需要2小时。

所以总路程是240英里，总时间是6小时……等等，240除以6还是每小时40英里！难道无论距离是多少，结果都一样吗？"
tutor,是的，你有一个绝妙的发现——无论距离是多少，平均速度永远是每小时40英里！这是因为当你改变距离时，时间也会成比例地改变，这意味着总路程与总时间的比率保持不变。你能不能用变量来表示速度，为这类往返问题写一个通用公式，这样下次你甚至不需要选择一个测试距离了？
student,"等等，一个全是字母的公式？你把我搞糊涂了。

如果我不用像60或120这样的虚拟距离，我怎么算出公式里的时间部分呢？我就把速度叫做x和y吗？"
tutor,这是个很好的起点，把速度叫做$x$和$y$非常完美。为了处理时间部分，我们用字母$d$来表示单程距离。既然时间总是等于距离除以速度，你会如何用$d$、$x$和$y$来表示去程和返程的时间呢？
student,好的，所以去程就是$d$除以$x$，对吗？返程就是$d$除以$y$？没有具体的数字感觉真奇怪。
tutor,你做得很好，刚开始对变量感到有点奇怪是完全正常的！你已经正确地将去程时间写为$d/x$，返程时间写为$d/y$。既然往返的总路程是$2d$，你会如何用这些表达式来写出平均速度的分数形式呢？
student,"所以分数的分子就是$2d$，分母是两个时间相加？比如$2d$除以($d/x + d/y$)？

这看起来太乱了！分数里面还有一个分数，这要怎么算啊？"
tutor,它看起来确实很乱，但你列的式子完全正确！为了简化它，我们先只看分母部分：你如何通过找公分母来将$d/x$和$d/y$这两个分数相加？一旦你把它们合并，你会看到一个巧妙的技巧，就是$d$实际上会完全被约掉。
student,"好的，所以公分母就是把$x$和$y$乘在一起得到$xy$吗？

那么分子部分就变成$dy$和$dx$，所以整个分母就是$(dy + dx)$除以$xy$？等等，我还是不明白$d$是怎么消失的。我做得对吗？"
tutor,你做得完全正确！如果你从新的分母中把$d$提取出来，它就变成了$\frac{d(y + x)}{xy}$。当你用总路程$2d$除以这一项时，你实际上是乘以它的倒数，这会把分子和分母上的$d$都约掉，最后得到一个简洁的公式：$\frac{2xy}{x + y}$。
student,"哇，你讲倒数那部分我有点没跟上。但让我试试把30和60代入那个新公式里！

所以2乘以30乘以60是3600，30加60是90。3600除以90等于40！太酷了！所以我以后随时都可以用这个公式，而不用编一个虚拟距离了？"
